{
  "blockers": [
    "DEFAULT_ACL_OTHER_PRINCIPAL_REVIEW_REQUIRED:PUBLIC_SCHEMA|RELATION|GRANTEE",
    "DEFAULT_ACL_OTHER_PRINCIPAL_REVIEW_REQUIRED:PUBLIC_SCHEMA|SEQUENCE|GRANTEE"
  ],
  "businessRowReads": "NONE",
  "cleanupResult": "PASS",
  "connectionAttemptCount": 1,
  "defaultAclSemanticResult": "BLOCKED",
  "differences": [
    {
      "dangerous": false,
      "defaultAclKey": "PUBLIC_SCHEMA|RELATION",
      "grantOption": false,
      "granteeCategory": "SYSTEM_PLATFORM_MANAGED",
      "privilege": "DELETE",
      "type": "DEFAULT_PRIVILEGE_REMOVED"
    },
    {
      "dangerous": false,
      "defaultAclKey": "PUBLIC_SCHEMA|RELATION",
      "grantOption": false,
      "granteeCategory": "SYSTEM_PLATFORM_MANAGED",
      "privilege": "INSERT",
      "type": "DEFAULT_PRIVILEGE_REMOVED"
    },
    {
      "dangerous": false,
      "defaultAclKey": "PUBLIC_SCHEMA|RELATION",
      "grantOption": false,
      "granteeCategory": "SYSTEM_PLATFORM_MANAGED",
      "privilege": "MAINTAIN",
      "type": "DEFAULT_PRIVILEGE_REMOVED"
    },
    {
      "dangerous": false,
      "defaultAclKey": "PUBLIC_SCHEMA|RELATION",
      "grantOption": false,
      "granteeCategory": "SYSTEM_PLATFORM_MANAGED",
      "privilege": "REFERENCES",
      "type": "DEFAULT_PRIVILEGE_REMOVED"
    },
    {
      "dangerous": false,
      "defaultAclKey": "PUBLIC_SCHEMA|RELATION",
      "grantOption": false,
      "granteeCategory": "SYSTEM_PLATFORM_MANAGED",
      "privilege": "SELECT",
      "type": "DEFAULT_PRIVILEGE_REMOVED"
    },
    {
      "dangerous": false,
      "defaultAclKey": "PUBLIC_SCHEMA|RELATION",
      "grantOption": false,
      "granteeCategory": "SYSTEM_PLATFORM_MANAGED",
      "privilege": "TRIGGER",
      "type": "DEFAULT_PRIVILEGE_REMOVED"
    },
    {
      "dangerous": false,
      "defaultAclKey": "PUBLIC_SCHEMA|RELATION",
      "grantOption": false,
      "granteeCategory": "SYSTEM_PLATFORM_MANAGED",
      "privilege": "TRUNCATE",
      "type": "DEFAULT_PRIVILEGE_REMOVED"
    },
    {
      "dangerous": false,
      "defaultAclKey": "PUBLIC_SCHEMA|RELATION",
      "grantOption": false,
      "granteeCategory": "SYSTEM_PLATFORM_MANAGED",
      "privilege": "UPDATE",
      "type": "DEFAULT_PRIVILEGE_REMOVED"
    },
    {
      "dangerous": false,
      "defaultAclKey": "PUBLIC_SCHEMA|SEQUENCE",
      "grantOption": false,
      "granteeCategory": "SYSTEM_PLATFORM_MANAGED",
      "privilege": "USAGE",
      "type": "DEFAULT_PRIVILEGE_REMOVED"
    },
    {
      "dangerous": true,
      "defaultAclKey": "PUBLIC_SCHEMA|RELATION",
      "grantOption": true,
      "granteeCategory": "OTHER_NAMED_PRINCIPAL",
      "privilege": "DELETE",
      "type": "DEFAULT_PRIVILEGE_ADDED"
    },
    {
      "dangerous": true,
      "defaultAclKey": "PUBLIC_SCHEMA|RELATION",
      "grantOption": true,
      "granteeCategory": "OTHER_NAMED_PRINCIPAL",
      "privilege": "INSERT",
      "type": "DEFAULT_PRIVILEGE_ADDED"
    },
    {
      "dangerous": true,
      "defaultAclKey": "PUBLIC_SCHEMA|RELATION",
      "grantOption": true,
      "granteeCategory": "OTHER_NAMED_PRINCIPAL",
      "privilege": "MAINTAIN",
      "type": "DEFAULT_PRIVILEGE_ADDED"
    },
    {
      "dangerous": true,
      "defaultAclKey": "PUBLIC_SCHEMA|RELATION",
      "grantOption": true,
      "granteeCategory": "OTHER_NAMED_PRINCIPAL",
      "privilege": "REFERENCES",
      "type": "DEFAULT_PRIVILEGE_ADDED"
    },
    {
      "dangerous": true,
      "defaultAclKey": "PUBLIC_SCHEMA|RELATION",
      "grantOption": true,
      "granteeCategory": "OTHER_NAMED_PRINCIPAL",
      "privilege": "SELECT",
      "type": "DEFAULT_PRIVILEGE_ADDED"
    },
    {
      "dangerous": true,
      "defaultAclKey": "PUBLIC_SCHEMA|RELATION",
      "grantOption": true,
      "granteeCategory": "OTHER_NAMED_PRINCIPAL",
      "privilege": "TRIGGER",
      "type": "DEFAULT_PRIVILEGE_ADDED"
    },
    {
      "dangerous": true,
      "defaultAclKey": "PUBLIC_SCHEMA|RELATION",
      "grantOption": true,
      "granteeCategory": "OTHER_NAMED_PRINCIPAL",
      "privilege": "TRUNCATE",
      "type": "DEFAULT_PRIVILEGE_ADDED"
    },
    {
      "dangerous": true,
      "defaultAclKey": "PUBLIC_SCHEMA|RELATION",
      "grantOption": true,
      "granteeCategory": "OTHER_NAMED_PRINCIPAL",
      "privilege": "UPDATE",
      "type": "DEFAULT_PRIVILEGE_ADDED"
    },
    {
      "dangerous": true,
      "defaultAclKey": "PUBLIC_SCHEMA|SEQUENCE",
      "grantOption": true,
      "granteeCategory": "OTHER_NAMED_PRINCIPAL",
      "privilege": "SELECT",
      "type": "DEFAULT_PRIVILEGE_ADDED"
    },
    {
      "dangerous": true,
      "defaultAclKey": "PUBLIC_SCHEMA|SEQUENCE",
      "grantOption": true,
      "granteeCategory": "OTHER_NAMED_PRINCIPAL",
      "privilege": "UPDATE",
      "type": "DEFAULT_PRIVILEGE_ADDED"
    },
    {
      "dangerous": true,
      "defaultAclKey": "PUBLIC_SCHEMA|SEQUENCE",
      "grantOption": true,
      "granteeCategory": "OTHER_NAMED_PRINCIPAL",
      "privilege": "USAGE",
      "type": "DEFAULT_PRIVILEGE_ADDED"
    }
  ],
  "entries": [
    {
      "aclState": "BUILTIN_DEFAULT",
      "defaultAclKey": "PUBLIC_SCHEMA|RELATION",
      "grantOption": false,
      "granteeCategory": "SYSTEM_PLATFORM_MANAGED",
      "grantorCategory": "SYSTEM_PLATFORM_MANAGED",
      "modelVersion": "bankeban-default-acl-principal-classification-v1",
      "objectType": "RELATION",
      "ownerCategory": "SYSTEM_PLATFORM_MANAGED",
      "principalClassifications": [
        {
          "category": "SYSTEM_PLATFORM_MANAGED",
          "position": "OWNER"
        },
        {
          "category": "SYSTEM_PLATFORM_MANAGED",
          "position": "GRANTEE"
        },
        {
          "category": "SYSTEM_PLATFORM_MANAGED",
          "position": "GRANTOR"
        }
      ],
      "privilege": "DELETE",
      "schemaKey": "PUBLIC_SCHEMA"
    },
    {
      "aclState": "BUILTIN_DEFAULT",
      "defaultAclKey": "PUBLIC_SCHEMA|RELATION",
      "grantOption": false,
      "granteeCategory": "SYSTEM_PLATFORM_MANAGED",
      "grantorCategory": "SYSTEM_PLATFORM_MANAGED",
      "modelVersion": "bankeban-default-acl-principal-classification-v1",
      "objectType": "RELATION",
      "ownerCategory": "SYSTEM_PLATFORM_MANAGED",
      "principalClassifications": [
        {
          "category": "SYSTEM_PLATFORM_MANAGED",
          "position": "OWNER"
        },
        {
          "category": "SYSTEM_PLATFORM_MANAGED",
          "position": "GRANTEE"
        },
        {
          "category": "SYSTEM_PLATFORM_MANAGED",
          "position": "GRANTOR"
        }
      ],
      "privilege": "INSERT",
      "schemaKey": "PUBLIC_SCHEMA"
    },
    {
      "aclState": "BUILTIN_DEFAULT",
      "defaultAclKey": "PUBLIC_SCHEMA|RELATION",
      "grantOption": false,
      "granteeCategory": "SYSTEM_PLATFORM_MANAGED",
      "grantorCategory": "SYSTEM_PLATFORM_MANAGED",
      "modelVersion": "bankeban-default-acl-principal-classification-v1",
      "objectType": "RELATION",
      "ownerCategory": "SYSTEM_PLATFORM_MANAGED",
      "principalClassifications": [
        {
          "category": "SYSTEM_PLATFORM_MANAGED",
          "position": "OWNER"
        },
        {
          "category": "SYSTEM_PLATFORM_MANAGED",
          "position": "GRANTEE"
        },
        {
          "category": "SYSTEM_PLATFORM_MANAGED",
          "position": "GRANTOR"
        }
      ],
      "privilege": "MAINTAIN",
      "schemaKey": "PUBLIC_SCHEMA"
    },
    {
      "aclState": "BUILTIN_DEFAULT",
      "defaultAclKey": "PUBLIC_SCHEMA|RELATION",
      "grantOption": false,
      "granteeCategory": "SYSTEM_PLATFORM_MANAGED",
      "grantorCategory": "SYSTEM_PLATFORM_MANAGED",
      "modelVersion": "bankeban-default-acl-principal-classification-v1",
      "objectType": "RELATION",
      "ownerCategory": "SYSTEM_PLATFORM_MANAGED",
      "principalClassifications": [
        {
          "category": "SYSTEM_PLATFORM_MANAGED",
          "position": "OWNER"
        },
        {
          "category": "SYSTEM_PLATFORM_MANAGED",
          "position": "GRANTEE"
        },
        {
          "category": "SYSTEM_PLATFORM_MANAGED",
          "position": "GRANTOR"
        }
      ],
      "privilege": "REFERENCES",
      "schemaKey": "PUBLIC_SCHEMA"
    },
    {
      "aclState": "BUILTIN_DEFAULT",
      "defaultAclKey": "PUBLIC_SCHEMA|RELATION",
      "grantOption": false,
      "granteeCategory": "SYSTEM_PLATFORM_MANAGED",
      "grantorCategory": "SYSTEM_PLATFORM_MANAGED",
      "modelVersion": "bankeban-default-acl-principal-classification-v1",
      "objectType": "RELATION",
      "ownerCategory": "SYSTEM_PLATFORM_MANAGED",
      "principalClassifications": [
        {
          "category": "SYSTEM_PLATFORM_MANAGED",
          "position": "OWNER"
        },
        {
          "category": "SYSTEM_PLATFORM_MANAGED",
          "position": "GRANTEE"
        },
        {
          "category": "SYSTEM_PLATFORM_MANAGED",
          "position": "GRANTOR"
        }
      ],
      "privilege": "SELECT",
      "schemaKey": "PUBLIC_SCHEMA"
    },
    {
      "aclState": "BUILTIN_DEFAULT",
      "defaultAclKey": "PUBLIC_SCHEMA|RELATION",
      "grantOption": false,
      "granteeCategory": "SYSTEM_PLATFORM_MANAGED",
      "grantorCategory": "SYSTEM_PLATFORM_MANAGED",
      "modelVersion": "bankeban-default-acl-principal-classification-v1",
      "objectType": "RELATION",
      "ownerCategory": "SYSTEM_PLATFORM_MANAGED",
      "principalClassifications": [
        {
          "category": "SYSTEM_PLATFORM_MANAGED",
          "position": "OWNER"
        },
        {
          "category": "SYSTEM_PLATFORM_MANAGED",
          "position": "GRANTEE"
        },
        {
          "category": "SYSTEM_PLATFORM_MANAGED",
          "position": "GRANTOR"
        }
      ],
      "privilege": "TRIGGER",
      "schemaKey": "PUBLIC_SCHEMA"
    },
    {
      "aclState": "BUILTIN_DEFAULT",
      "defaultAclKey": "PUBLIC_SCHEMA|RELATION",